
Bus 001 Device 004: ID 0483:df11 SGS Thomson Microelectronics 
Device Descriptor:
  bLength                18
  bDescriptorType         1
  bcdUSB               1.00
  bDeviceClass            0 (Defined at Interface level)
  bDeviceSubClass         0 
  bDeviceProtocol         0 
  bMaxPacketSize0        64
  idVendor           0x0483 SGS Thomson Microelectronics
  idProduct          0xdf11 
  bcdDevice            2.00
  iManufacturer           1 STMicroelectronics
  iProduct                2 STM32 DFU
  iSerial                 3 ÿÿÿÿÿÿÿÿÿÿÿÿ
  bNumConfigurations      1
  Configuration Descriptor:
    bLength                 9
    bDescriptorType         2
    wTotalLength           36
    bNumInterfaces          1
    bConfigurationValue     1
    iConfiguration          0 
    bmAttributes         0xc0
      Self Powered
    MaxPower              100mA
    Interface Descriptor:
      bLength                 9
      bDescriptorType         4
      bInterfaceNumber        0
      bAlternateSetting       0
      bNumEndpoints           0
      bInterfaceClass       254 Application Specific Interface
      bInterfaceSubClass      1 Device Firmware Update
      bInterfaceProtocol      2 
      iInterface              4 @Internal Flash  /0x08000000/12*001Ka,116*001Kg
    Interface Descriptor:
      bLength                 9
      bDescriptorType         4
      bInterfaceNumber        0
      bAlternateSetting       1
      bNumEndpoints           0
      bInterfaceClass       254 Application Specific Interface
      bInterfaceSubClass      1 Device Firmware Update
      bInterfaceProtocol      2 
      iInterface              5 @SPI Flash : M25P64/0x00000000/128*64Kg
      Device Firmware Upgrade Interface Descriptor:
        bLength                             9
        bDescriptorType                    33
        bmAttributes                       11
          Will Detach
          Manifestation Intolerant
          Upload Supported
          Download Supported
        wDetachTimeout                    255 milliseconds
        wTransferSize                    1024 bytes
        bcdDFUVersion                   1a.01
Device Status:     0x0001
  Self Powered
