
Bus 006 Device 017: ID 16c0:0762 VOTI 
Device Descriptor:
  bLength                18
  bDescriptorType         1
  bcdUSB               1.00
  bDeviceClass            0 (Defined at Interface level)
  bDeviceSubClass         0 
  bDeviceProtocol         0 
  bMaxPacketSize0         8
  idVendor           0x16c0 VOTI
  idProduct          0x0762 
  bcdDevice            0.00
  iManufacturer           1 sysmocom - systems for mobile communications GmbH
  iProduct                2 SimTrace SIM Sniffer - DFU Mode
  iSerial                 0 
  bNumConfigurations      1
  Configuration Descriptor:
    bLength                 9
    bDescriptorType         2
    wTotalLength           45
    bNumInterfaces          1
    bConfigurationValue     1
    iConfiguration          3 SimTrace DFU Configuration
    bmAttributes         0x80
      (Bus Powered)
    MaxPower              200mA
    Interface Descriptor:
      bLength                 9
      bDescriptorType         4
      bInterfaceNumber        0
      bAlternateSetting       0
      bNumEndpoints           0
      bInterfaceClass       254 Application Specific Interface
      bInterfaceSubClass      1 Device Firmware Update
      bInterfaceProtocol      2 
      iInterface              4 SimTrace DFU Interface - Application Partition
    Interface Descriptor:
      bLength                 9
      bDescriptorType         4
      bInterfaceNumber        0
      bAlternateSetting       1
      bNumEndpoints           0
      bInterfaceClass       254 Application Specific Interface
      bInterfaceSubClass      1 Device Firmware Update
      bInterfaceProtocol      2 
      iInterface              5 SimTrace DFU Interface - Bootloader Partition
    Interface Descriptor:
      bLength                 9
      bDescriptorType         4
      bInterfaceNumber        0
      bAlternateSetting       2
      bNumEndpoints           0
      bInterfaceClass       254 Application Specific Interface
      bInterfaceSubClass      1 Device Firmware Update
      bInterfaceProtocol      2 
      iInterface              6 SimTrace DFU Interface - RAM
      Device Firmware Upgrade Interface Descriptor:
        bLength                             9
        bDescriptorType                    33
        bmAttributes                        3
          Will Not Detach
          Manifestation Intolerant
          Upload Supported
          Download Supported
        wDetachTimeout                  65280 milliseconds
        wTransferSize                     256 bytes
        bcdDFUVersion                   1.00
Device Status:     0x0000
  (Bus Powered)
